{
  "session_id": "full-flow-board-log-rework-closure",
  "producer_agent": "workflow-orchestrator",
  "current_workflow": "board_validation",
  "current_phase": "routing_after_failed_board_validation",
  "active_role": "workflow-orchestrator",
  "pending_artifacts": ["board_failure_review", "main_route_decision", "route_history"],
  "completed_artifacts": ["prompt_context", "task_profile", "workflow_plan", "incident_report", "root_cause_hypotheses", "implementation_plan", "code_change_manifest", "review_decision", "board_validation_result"],
  "open_decision_points": ["board_validation_failed"],
  "status": "blocked"
}
